{
  "schemaVersion": "3.0.0",
  "id": "source-ipa-2017h29a-fe-pm-12-qs",
  "title": "平成29年度 秋期 基本情報技術者試験 午後 問12 部分ビット列の検索と置換 全4頁",
  "publisher": "独立行政法人情報処理推進機構（IPA）",
  "url": "https://www.ipa.go.jp/shiken/mondai-kaiotu/gmcbt8000000fqpm-att/2017h29a_fe_pm_qs.pdf",
  "sha256": "787ad5492b60949988e7e39ca532ac7c1c78ebfe5b3cbd9af4e6f621793ddd9a",
  "checkedOn": "2026-10-26",
  "type": "official_problem",
  "availability": "officially_published",
  "scope": "QS64〜67、図1、28/43行、全33択、全前提/注記。",
  "sections": [
    "p64 問12",
    "p65 問12",
    "p66 問12",
    "p67 問12"
  ],
  "dateNote": "冊子掲載年度と添付個別初回公開日を同一と断定しない。",
  "facts": [
    "1語16bit、α2語32bit、β/γ左詰め、n1〜16、先頭一致、GR1〜7復元。"
  ],
  "supports": [
    "annual-sets",
    "random-mix",
    "answer-validation"
  ],
  "limits": "問12の問題PDF物理p64〜67の全本文、図表、注記と解答群に限る。 他の大問・付属資料・第三者素材へこの条件判断を拡張しない。独自解説の条件は公式素材と分ける。"
}
