{
  "schemaVersion": "3.0.0",
  "id": "source-ipa-2017h29a-fe-pm-8-common-notation",
  "title": "平成29年度 秋期 基本情報技術者試験 午後 共通擬似言語記法 物理4〜5頁",
  "publisher": "独立行政法人情報処理推進機構（IPA）",
  "url": "https://www.ipa.go.jp/shiken/mondai-kaiotu/gmcbt8000000fqpm-att/2017h29a_fe_pm_qs.pdf",
  "sha256": "787ad5492b60949988e7e39ca532ac7c1c78ebfe5b3cbd9af4e6f621793ddd9a",
  "checkedOn": "2026-10-26",
  "type": "official_problem",
  "availability": "officially_published",
  "scope": "QS物理4〜5頁の共通記法，宣言/注釈/全制御記号/演算と整数商/剰余/論理型定数。",
  "sections": [
    "物理p4 共通記法",
    "物理p5 共通記法"
  ],
  "dateNote": "2017年度公式掲載公開2017-10-15/更新2018-01-12。個別PDF添付日とは分ける。",
  "facts": [
    "旧制度・午後150分の必須問8。6解答欄を全て解答する。",
    "各問題文に注記がない限り共通記法を適用する。問8単独利用でも2頁を参照できる。"
  ],
  "supports": [
    "source-format",
    "answer-validation"
  ],
  "limits": "問8で参照するIPA共通疑似言語の記述形式、問題PDF物理p4〜5に限る。 他の大問・付属資料・第三者素材へこの条件判断を拡張しない。独自解説の条件は公式素材と分ける。"
}
