{
  "schemaVersion": "3.0.0",
  "id": "source-ipa-2017h29a-fe-pm-5-qs",
  "title": "平成29年度 秋期 基本情報技術者試験 午後 問5 買上げ・入金の月次集計全5頁",
  "publisher": "独立行政法人情報処理推進機構（IPA）",
  "url": "https://www.ipa.go.jp/shiken/mondai-kaiotu/gmcbt8000000fqpm-att/2017h29a_fe_pm_qs.pdf",
  "sha256": "787ad5492b60949988e7e39ca532ac7c1c78ebfe5b3cbd9af4e6f621793ddd9a",
  "checkedOn": "2026-10-26",
  "type": "official_problem",
  "availability": "officially_published",
  "scope": "QS物理23〜27頁の全本文・2図・2表・6欄27択33参照。",
  "sections": [
    "物理p23 問5",
    "物理p24 問5",
    "物理p25 問5",
    "物理p26 問5",
    "物理p27 問5"
  ],
  "dateNote": "年度掲載公開2017-10-15/更新2018-01-12。個別PDF添付日と混同しない。",
  "facts": [
    "旧制度・午後150分，問2〜7から4問を選ぶ大問の一つ。",
    "月間買上げ額確定後にFIFOで消し込む。"
  ],
  "supports": [
    "source-format",
    "answer-validation"
  ],
  "limits": "問5の問題PDF物理p23〜27の全本文、図表、注記と解答群に限る。 他の大問・付属資料・第三者素材へこの条件判断を拡張しない。独自解説の条件は公式素材と分ける。"
}
