[{"schemaVersion":"3.0.0","id":"source-ipa-2019h31h-fe-pm-11-qs","title":"平成31年度 春期 基本情報技術者試験 午後 問11 原問題","publisher":"独立行政法人情報処理推進機構（IPA）","url":"https://www.ipa.go.jp/shiken/mondai-kaiotu/gmcbt8000000ddiw-att/2019h31h_fe_pm_qs.pdf","sha256":"bfd415139913f156ea36b5de5f3d8a6fba7efd721b67c1be12ec45cc693df0dd","checkedOn":"2026-10-29","type":"official_problem","availability":"officially_published","scope":"問11 原問題 物理p.58、59、60、61、62、63。この大問と固定参考の個別範囲のみ。別年度・別素材に一般化しない。","sections":["物理p.58","物理p.59","物理p.60","物理p.61","物理p.62","物理p.63"],"dateNote":"試験年度から個別PDFの初公開日を補完しない。","facts":["公式出題分野（QS2）：ソフトウェア開発（Java）。学習分類とは別。","6操作欄/6正答group/22固有択/30欄別参照。"],"supports":["annual-sets","random-mix","answer-validation"],"limits":"この大問と固定参考の個別範囲のみ。別年度・別素材に一般化しない。"},{"schemaVersion":"3.0.0","id":"source-ipa-2019h31h-fe-pm-11-ans","title":"平成31年度 春期 基本情報技術者試験 午後 問11 公式解答例","publisher":"独立行政法人情報処理推進機構（IPA）","url":"https://www.ipa.go.jp/shiken/mondai-kaiotu/gmcbt8000000ddiw-att/2019h31h_fe_pm_ans.pdf","sha256":"8085576c2b5d6db18c9b9ecb00c7b0b9b120eb2be8ac977961b4c81e8c3a52d8","checkedOn":"2026-10-29","type":"official_answer","availability":"officially_published","scope":"問11 公式解答例 物理p.1。この大問と固定参考の個別範囲のみ。別年度・別素材に一般化しない。","sections":["物理p.1"],"dateNote":"試験年度から個別PDFの初公開日を補完しない。","facts":["公式出題分野（QS2）：ソフトウェア開発（Java）。学習分類とは別。","6操作欄/6正答group/22固有択/30欄別参照。"],"supports":["annual-sets","random-mix","answer-validation"],"limits":"この大問と固定参考の個別範囲のみ。別年度・別素材に一般化しない。"},{"schemaVersion":"3.0.0","id":"source-ipa-2019h31h-fe-pm-11-api","title":"平成31年度 春期 基本情報技術者試験 午後 問11 Javaプログラムで使用するAPIの説明（原p77〜78）","publisher":"独立行政法人情報処理推進機構（IPA）","url":"https://www.ipa.go.jp/shiken/mondai-kaiotu/gmcbt8000000ddiw-att/2019h31h_fe_pm_qs.pdf","sha256":"bfd415139913f156ea36b5de5f3d8a6fba7efd721b67c1be12ec45cc693df0dd","checkedOn":"2026-10-29","type":"official_problem","availability":"officially_published","scope":"問11 Javaプログラムで使用するAPIの説明（原p77〜78） 物理p.77、78。当該API77/78の3型8操作11項目の短い試験用機能要約だけを固定参考として扱う。Oracle文書全体・コード例の再許諾や，IPAの著作者・契約・原典版の証明ではない。","sections":["物理p.77","物理p.78"],"dateNote":"試験年度から個別PDFの初公開日を補完しない。","facts":["公式出題分野（QS2）：ソフトウェア開発（Java）。学習分類とは別。","当該年度の固定参考。原の文言・署名・順序と素材別の帰属を保持する。"],"supports":["annual-sets","random-mix","answer-validation"],"limits":"当該API77/78の3型8操作11項目の短い試験用機能要約だけを固定参考として扱う。Oracle文書全体・コード例の再許諾や，IPAの著作者・契約・原典版の証明ではない。"},{"schemaVersion":"3.0.0","id":"source-ipa-2019h31h-fe-pm-12-qs","title":"平成31年度 春期 基本情報技術者試験 午後 問12 原問題","publisher":"独立行政法人情報処理推進機構（IPA）","url":"https://www.ipa.go.jp/shiken/mondai-kaiotu/gmcbt8000000ddiw-att/2019h31h_fe_pm_qs.pdf","sha256":"bfd415139913f156ea36b5de5f3d8a6fba7efd721b67c1be12ec45cc693df0dd","checkedOn":"2026-10-29","type":"official_problem","availability":"officially_published","scope":"問12 原問題 物理p.64、65、66、67、68。原コードの符号なし引数全域での正しさは保証しない。位置15・長さ65521・4096語では16bitADDLの桁あふれ後CPLがOFを上書きし，対象全ビットを1にできない独立反例を再現した。原の44/24，採点講評8/4，0長/語境界と各改変例の検算は全域保証ではない。原本文/原コード/公式6解答を保持し，公式訂正や未記載の上限追加とは扱わない。","sections":["物理p.64","物理p.65","物理p.66","物理p.67","物理p.68"],"dateNote":"試験年度から個別PDFの初公開日を補完しない。","facts":["公式出題分野（QS2）：ソフトウェア開発（アセンブラ）。学習分類とは別。","6操作欄/6正答group/27固有択/33欄別参照。"],"supports":["annual-sets","random-mix","answer-validation"],"limits":"原コードの符号なし引数全域での正しさは保証しない。位置15・長さ65521・4096語では16bitADDLの桁あふれ後CPLがOFを上書きし，対象全ビットを1にできない独立反例を再現した。原の44/24，採点講評8/4，0長/語境界と各改変例の検算は全域保証ではない。原本文/原コード/公式6解答を保持し，公式訂正や未記載の上限追加とは扱わない。"},{"schemaVersion":"3.0.0","id":"source-ipa-2019h31h-fe-pm-12-ans","title":"平成31年度 春期 基本情報技術者試験 午後 問12 公式解答例","publisher":"独立行政法人情報処理推進機構（IPA）","url":"https://www.ipa.go.jp/shiken/mondai-kaiotu/gmcbt8000000ddiw-att/2019h31h_fe_pm_ans.pdf","sha256":"8085576c2b5d6db18c9b9ecb00c7b0b9b120eb2be8ac977961b4c81e8c3a52d8","checkedOn":"2026-10-29","type":"official_answer","availability":"officially_published","scope":"問12 公式解答例 物理p.1。この大問と固定参考の個別範囲のみ。別年度・別素材に一般化しない。","sections":["物理p.1"],"dateNote":"試験年度から個別PDFの初公開日を補完しない。","facts":["公式出題分野（QS2）：ソフトウェア開発（アセンブラ）。学習分類とは別。","6操作欄/6正答group/27固有択/33欄別参照。"],"supports":["annual-sets","random-mix","answer-validation"],"limits":"この大問と固定参考の個別範囲のみ。別年度・別素材に一般化しない。"},{"schemaVersion":"3.0.0","id":"source-ipa-2019h31h-fe-pm-12-casl","title":"平成31年度 春期 基本情報技術者試験 午後 問12 アセンブラ言語の仕様（原p79〜84，p81は命令表上部のみ）","publisher":"独立行政法人情報処理推進機構（IPA）","url":"https://www.ipa.go.jp/shiken/mondai-kaiotu/gmcbt8000000ddiw-att/2019h31h_fe_pm_qs.pdf","sha256":"bfd415139913f156ea36b5de5f3d8a6fba7efd721b67c1be12ec45cc693df0dd","checkedOn":"2026-10-29","type":"official_problem","availability":"officially_published","scope":"問12 アセンブラ言語の仕様（原p79〜84，p81は命令表上部のみ） 物理p.79、80、81、82、83、84。物理p81は上部[0,0,1432,1240]のみ。命令表のOF末尾と最後の―までを保持し，JIS1.3の見出し/説明/文字表/全下部pixelは対象外。","sections":["物理p.79","物理p.80","物理p.81","物理p.82","物理p.83","物理p.84"],"dateNote":"試験年度から個別PDFの初公開日を補完しない。","facts":["公式出題分野（QS2）：ソフトウェア開発（アセンブラ）。学習分類とは別。","当該年度の固定参考。原の文言・署名・順序と素材別の帰属を保持する。"],"supports":["annual-sets","random-mix","answer-validation"],"limits":"物理p81は上部[0,0,1432,1240]のみ。命令表のOF末尾と最後の―までを保持し，JIS1.3の見出し/説明/文字表/全下部pixelは対象外。"},{"schemaVersion":"3.0.0","id":"source-ipa-2019h31h-fe-pm-13-qs","title":"平成31年度 春期 基本情報技術者試験 午後 問13 原問題","publisher":"独立行政法人情報処理推進機構（IPA）","url":"https://www.ipa.go.jp/shiken/mondai-kaiotu/gmcbt8000000ddiw-att/2019h31h_fe_pm_qs.pdf","sha256":"bfd415139913f156ea36b5de5f3d8a6fba7efd721b67c1be12ec45cc693df0dd","checkedOn":"2026-10-29","type":"official_problem","availability":"officially_published","scope":"問13 原問題 物理p.69、70、71、72、73、74、75、76。原マクロは指定商品を購入していない会員の商品最終日を配列へ代入せず，両販売額0の比較で未代入要素を参照し得る。当該付属仕様では配列の初期値や未代入参照の扱いの明記を確認できない。原本文・マクロ・公式解答は保持する。改変例の販売明細では，全会員が指定商品を購入しており，最終購入日が実データから定まる。","sections":["物理p.69","物理p.70","物理p.71","物理p.72","物理p.73","物理p.74","物理p.75","物理p.76"],"dateNote":"試験年度から個別PDFの初公開日を補完しない。","facts":["公式出題分野（QS2）：ソフトウェア開発（表計算）。学習分類とは別。","6操作欄/6正答group/33固有択/33欄別参照。"],"supports":["annual-sets","random-mix","answer-validation"],"limits":"原マクロは指定商品を購入していない会員の商品最終日を配列へ代入せず，両販売額0の比較で未代入要素を参照し得る。当該付属仕様では配列の初期値や未代入参照の扱いの明記を確認できない。原本文・マクロ・公式解答は保持する。改変例の販売明細では，全会員が指定商品を購入しており，最終購入日が実データから定まる。"},{"schemaVersion":"3.0.0","id":"source-ipa-2019h31h-fe-pm-13-ans","title":"平成31年度 春期 基本情報技術者試験 午後 問13 公式解答例","publisher":"独立行政法人情報処理推進機構（IPA）","url":"https://www.ipa.go.jp/shiken/mondai-kaiotu/gmcbt8000000ddiw-att/2019h31h_fe_pm_ans.pdf","sha256":"8085576c2b5d6db18c9b9ecb00c7b0b9b120eb2be8ac977961b4c81e8c3a52d8","checkedOn":"2026-10-29","type":"official_answer","availability":"officially_published","scope":"問13 公式解答例 物理p.1。この大問と固定参考の個別範囲のみ。別年度・別素材に一般化しない。","sections":["物理p.1"],"dateNote":"試験年度から個別PDFの初公開日を補完しない。","facts":["公式出題分野（QS2）：ソフトウェア開発（表計算）。学習分類とは別。","6操作欄/6正答group/33固有択/33欄別参照。"],"supports":["annual-sets","random-mix","answer-validation"],"limits":"この大問と固定参考の個別範囲のみ。別年度・別素材に一般化しない。"},{"schemaVersion":"3.0.0","id":"source-ipa-2019h31h-fe-pm-13-common","title":"平成31年度 春期 基本情報技術者試験 午後 問13 共通に使用される擬似言語の記述形式（原p3〜4）","publisher":"独立行政法人情報処理推進機構（IPA）","url":"https://www.ipa.go.jp/shiken/mondai-kaiotu/gmcbt8000000ddiw-att/2019h31h_fe_pm_qs.pdf","sha256":"bfd415139913f156ea36b5de5f3d8a6fba7efd721b67c1be12ec45cc693df0dd","checkedOn":"2026-10-29","type":"official_problem","availability":"officially_published","scope":"問13 共通に使用される擬似言語の記述形式（原p3〜4） 物理p.3、4。この大問と固定参考の個別範囲のみ。別年度・別素材に一般化しない。","sections":["物理p.3","物理p.4"],"dateNote":"試験年度から個別PDFの初公開日を補完しない。","facts":["公式出題分野（QS2）：ソフトウェア開発（表計算）。学習分類とは別。","当該年度の固定参考。原の文言・署名・順序と素材別の帰属を保持する。"],"supports":["annual-sets","random-mix","answer-validation"],"limits":"この大問と固定参考の個別範囲のみ。別年度・別素材に一般化しない。"},{"schemaVersion":"3.0.0","id":"source-ipa-2019h31h-fe-pm-13-sheet","title":"平成31年度 春期 基本情報技術者試験 午後 問13 表計算ソフトの機能・用語（原p85〜90）","publisher":"独立行政法人情報処理推進機構（IPA）","url":"https://www.ipa.go.jp/shiken/mondai-kaiotu/gmcbt8000000ddiw-att/2019h31h_fe_pm_qs.pdf","sha256":"bfd415139913f156ea36b5de5f3d8a6fba7efd721b67c1be12ec45cc693df0dd","checkedOn":"2026-10-29","type":"official_problem","availability":"officially_published","scope":"問13 表計算ソフトの機能・用語（原p85〜90） 物理p.85、86、87、88、89、90。この大問と固定参考の個別範囲のみ。別年度・別素材に一般化しない。","sections":["物理p.85","物理p.86","物理p.87","物理p.88","物理p.89","物理p.90"],"dateNote":"試験年度から個別PDFの初公開日を補完しない。","facts":["公式出題分野（QS2）：ソフトウェア開発（表計算）。学習分類とは別。","当該年度の固定参考。原の文言・署名・順序と素材別の帰属を保持する。"],"supports":["annual-sets","random-mix","answer-validation"],"limits":"この大問と固定参考の個別範囲のみ。別年度・別素材に一般化しない。"},{"schemaVersion":"3.0.0","id":"source-ipa-2019h31h-fe-pm-booklet","title":"平成31年度 春期 基本情報技術者試験 午後 表紙・問題選択方法","publisher":"独立行政法人情報処理推進機構（IPA）","url":"https://www.ipa.go.jp/shiken/mondai-kaiotu/gmcbt8000000ddiw-att/2019h31h_fe_pm_qs.pdf","sha256":"bfd415139913f156ea36b5de5f3d8a6fba7efd721b67c1be12ec45cc693df0dd","checkedOn":"2026-10-29","type":"official_problem","availability":"officially_published","scope":"物理p1の時間・問題選択方法と物理p2の問題一覧。印刷pageは物理pageと同じ。","sections":["物理p1 表紙・150分・問題選択","物理p2 問題一覧"],"dateNote":"試験年度から個別PDFの公開日を推測しない。","facts":["13大問。問1・8必須、問2〜7から4、問9〜13から1の計7大問・150分。","全78操作欄・77解答定義・78採点対象。問7c/dだけ順不同。正解なしの欄はない。公式配点・評価点とは別。"],"supports":["annual-sets","random-mix","answer-validation"],"limits":"時間と選択方法の出典のみ。個別素材・独立参考・既知の原コードの限界は各source/rightを参照する。"}]
