{
  "schemaVersion": "3.0.0",
  "id": "source-ipa-faq",
  "title": "試験に関するよくある質問",
  "publisher": "独立行政法人情報処理推進機構（IPA）",
  "url": "https://www.ipa.go.jp/shiken/faq.html",
  "dateNote": "ページに公開日の明示はない。FAQの最終更新日は2026-09-02。",
  "checkedOn": "2026-10-06",
  "type": "policy",
  "scope": "FE。2025年度の公開問題又はその利用条件に関係するIPA公開資料。",
  "availability": "officially_published",
  "sections": [
    "その他／過去問題の使用方法／留意点"
  ],
  "facts": [
    "教育目的等での公表過去問題の利用、出典の記載、改変の明示について案内している。"
  ],
  "supports": [
    "ingestion",
    "attribution"
  ],
  "limits": "GitHubという媒体を名指しした許可や第三者素材の包括的再許諾、画面資産の転載許可は明示していない。",
  "updatedOn": "2026-09-02"
}
