{
  "schemaVersion": "3.0.0",
  "id": "source-ipa-2017h29a-fe-pm-4-qs",
  "title": "平成29年度 秋期 基本情報技術者試験 午後 問4 問題",
  "publisher": "独立行政法人情報処理推進機構（IPA）",
  "url": "https://www.ipa.go.jp/shiken/mondai-kaiotu/gmcbt8000000fqpm-att/2017h29a_fe_pm_qs.pdf",
  "sha256": "787ad5492b60949988e7e39ca532ac7c1c78ebfe5b3cbd9af4e6f621793ddd9a",
  "checkedOn": "2026-10-26",
  "type": "official_problem",
  "availability": "officially_published",
  "scope": "QS物理p18、19、20、21、22の問4全本文・図表・注意書き・解答群。",
  "sections": [
    "p18 問4",
    "p19 問4",
    "p20 問4",
    "p21 問4",
    "p22 問4"
  ],
  "dateNote": "年度掲載日やサイト更新日を個別添付の公開日とは断定しない。",
  "facts": [
    "2017年度秋期の原冊子。春期の素材・権利判断を流用しない。"
  ],
  "supports": [
    "annual-sets",
    "random-mix",
    "answer-validation"
  ],
  "limits": "問4の問題PDF物理p18〜22の全本文、図表、注記と解答群に限る。 他の大問・付属資料・第三者素材へこの条件判断を拡張しない。独自解説の条件は公式素材と分ける。"
}
