{
  "schemaVersion": "3.0.0",
  "id": "source-ipa-2017h29a-fe-pm-12-ans",
  "title": "平成29年度 秋期 基本情報技術者試験 午後 問12 解答例6欄",
  "publisher": "独立行政法人情報処理推進機構（IPA）",
  "url": "https://www.ipa.go.jp/shiken/mondai-kaiotu/gmcbt8000000fqpm-att/2017h29a_fe_pm_ans.pdf",
  "sha256": "7bbf8eff0464a05ae1f65c9ecff1ee978c946fb1bd28ef13858e710b9d3678c1",
  "checkedOn": "2026-10-26",
  "type": "official_answer",
  "availability": "officially_published",
  "scope": "ANS1問12全6正答。",
  "sections": [
    "p1 問12 設問1a/b・設問2・設問3c/d・設問4"
  ],
  "dateNote": "冊子掲載年度と添付個別初回公開日を同一と断定しない。",
  "facts": [
    "1語16bit、α2語32bit、β/γ左詰め、n1〜16、先頭一致、GR1〜7復元。"
  ],
  "supports": [
    "annual-sets",
    "random-mix",
    "answer-validation"
  ],
  "limits": "公式解答例の物理p1、問12の全6解答欄に限る。 他の大問・付属資料・第三者素材へこの条件判断を拡張しない。独自解説の条件は公式素材と分ける。"
}
