{
  "schemaVersion": "3.0.0",
  "id": "source-ipa-2017h29h-fe-pm-4-qs",
  "title": "平成29年度 春期 基本情報技術者試験 午後 問4 無線LANデータ送信全4頁",
  "publisher": "独立行政法人情報処理推進機構（IPA）",
  "url": "https://www.ipa.go.jp/shiken/mondai-kaiotu/gmcbt8000000fzx1-att/2017h29h_fe_pm_qs.pdf",
  "sha256": "7d976c989149a8027c45cce63e420af0b4da8967e563146220dfa1e50eba43c8",
  "checkedOn": "2026-10-23",
  "type": "official_problem",
  "availability": "officially_published",
  "scope": "問4 p17〜20の全本文/4欄19択/7番号手順/Roman3工夫/2下線/図1と矢印注記。",
  "sections": [
    "p17 全7手順/W1>W2/選択注意",
    "p18 図1/注記/速度/2比較下線/設問1 a,b",
    "p19 設問2 c1,c2組合せ表6択",
    "p20 効率の定義/工夫3個/全6組合せ択"
  ],
  "dateNote": "年度掲載の公開2017-10-15/更新2018-01-12を春の個別添付日と断定しない。",
  "facts": [
    "旧午後150分、問2〜7から4問を選ぶ大問の一つ。",
    "問4局所Source。既存PM1/2/3/8のscopeと独立。"
  ],
  "supports": [
    "annual-sets",
    "random-mix",
    "answer-validation"
  ],
  "limits": "問4の原資料p17〜20の無線LANの作問図、本文、全注記と解答群に限る。共通記法、他の大問、規格原文、CASL及び言語付録をこの判断へ含めない。"
}
