{
  "schemaVersion": "3.0.0",
  "publisher": "独立行政法人情報処理推進機構（IPA）",
  "publishedOn": "2022-12-26",
  "checkedOn": "2026-10-19",
  "dateNote": "2022年12月26日公表のサンプル問題セット。受験年度とは区別する。",
  "availability": "officially_published",
  "supports": [
    "annual-sets",
    "random-mix",
    "answer-validation"
  ],
  "limits": "現行制度のサンプル60問であり、2022年度の実施問題や本番全問題ではない。",
  "url": "https://www.ipa.go.jp/shiken/syllabus/henkou/2022/ssf7ph000000h5tb-att/fe_kamoku_a_set_sample_ans.pdf",
  "sha256": "8fc77eee0fb06280462663a4ad507472112841b91dbb47a7cb301bc31ec75de9",
  "id": "source-ipa-sample-2022-dec-a-ans",
  "title": "基本情報技術者試験 科目A試験サンプル問題（2022年12月公表）解答",
  "type": "official_answer",
  "scope": "別紙p.1の60問の公式正答。独自解説はこの解答表の転載ではない。",
  "sections": [
    "p.1 解答・著作権表示"
  ],
  "facts": [
    "正答はエ、エ、エ、ア、イ、エ、イ、ウ、エ、ウ、ウ、イ、エ、エ、エ、ア、エ、エ、エ、エ、ア、イ、ア、イ、ア、エ、イ、エ、ア、ア、エ、ア、ウ、ウ、イ、ア、エ、イ、イ、イ、ウ、エ、ウ、エ、イ、エ、エ、イ、ア、ア、エ、ア、エ、エ、イ、エ、ウ、イ、イ、ウ。"
  ]
}
