{
  "schemaVersion": "3.0.0",
  "publisher": "独立行政法人情報処理推進機構（IPA）",
  "publishedOn": "2022-12-26",
  "checkedOn": "2026-10-19",
  "dateNote": "2022年12月26日公表のサンプル問題セット。受験年度とは区別する。",
  "availability": "officially_published",
  "supports": [
    "annual-sets",
    "random-mix",
    "answer-validation"
  ],
  "limits": "現行制度のサンプル20問であり、2022年度の実施問題や本番全問題ではない。",
  "url": "https://www.ipa.go.jp/shiken/syllabus/henkou/2022/ssf7ph000000h5tb-att/fe_kamoku_b_set_sample_qs.pdf",
  "sha256": "54e16b636f3c69fc30cd92dbbbcb1b0e0acbb1e64bbd5066e971dce954d7dd11",
  "id": "source-ipa-sample-2022-dec-b-qs",
  "title": "基本情報技術者試験 科目B試験サンプル問題（2022年12月公表）問題",
  "type": "official_sample",
  "scope": "PDF p.4〜35のサンプル全20問と共通の記述形式p.2〜3。",
  "sections": [
    "p.4〜35 問1〜20",
    "p.2〜3 疑似言語の記述形式",
    "p.40 著作権表示"
  ],
  "facts": [
    "アルゴリズム16問と情報セキュリティ4問。"
  ]
}
