{
  "schemaVersion": "3.0.0",
  "id": "source-ipa-2017h29a-fe-pm-3-ans",
  "title": "平成29年度 秋期 基本情報技術者試験 午後 問3 解答例",
  "publisher": "独立行政法人情報処理推進機構（IPA）",
  "url": "https://www.ipa.go.jp/shiken/mondai-kaiotu/gmcbt8000000fqpm-att/2017h29a_fe_pm_ans.pdf",
  "sha256": "7bbf8eff0464a05ae1f65c9ecff1ee978c946fb1bd28ef13858e710b9d3678c1",
  "checkedOn": "2026-10-26",
  "type": "official_answer",
  "availability": "officially_published",
  "scope": "ANS物理p1の問3の全解答欄。",
  "sections": [
    "p1 問3"
  ],
  "dateNote": "年度掲載日やサイト更新日を個別添付の公開日とは断定しない。",
  "facts": [
    "2017年度秋期の原冊子。春期の素材・権利判断を流用しない。"
  ],
  "supports": [
    "annual-sets",
    "random-mix",
    "answer-validation"
  ],
  "limits": "公式解答例の物理p1、問3の全4解答欄に限る。 他の大問・付属資料・第三者素材へこの条件判断を拡張しない。独自解説の条件は公式素材と分ける。"
}
