{
  "schemaVersion": "3.0.0",
  "id": "source-nist-sort-insertion",
  "title": "NIST Dictionary of Algorithms and Data Structures: insertionSort",
  "publisher": "National Institute of Standards and Technology (NIST)",
  "url": "https://xlinux.nist.gov/dads/HTML/insertionSort.html",
  "updatedOn": "2023-04-06",
  "dateNote": "Entry modifiedの日付を更新日として記録。HTML整形日とは区別し、公開日は記載未確認。",
  "checkedOn": "2026-10-14",
  "type": "independent_note",
  "scope": "ソートアルゴリズムと関連データ構造の定義。FEの公式解説ではない。",
  "availability": "officially_published",
  "sections": [
    "Definition",
    "Note"
  ],
  "facts": [
    "整列済み部分へ値を挿入する整列。一般にO(n²)。"
  ],
  "supports": [
    "detailed-sort-explanation"
  ],
  "limits": "定義を照合する根拠資料。ページ本文・図・実装コードを転載せず、解説とコードは独自作成。本画面の変種の操作回数は独立実装で検算する。"
}
