{
  "schemaVersion": "3.0.0",
  "id": "source-ipa-2017h29a-fe-pm-8-qs",
  "title": "平成29年度 秋期 基本情報技術者試験 午後 問8 検査文字 全8頁",
  "publisher": "独立行政法人情報処理推進機構（IPA）",
  "url": "https://www.ipa.go.jp/shiken/mondai-kaiotu/gmcbt8000000fqpm-att/2017h29a_fe_pm_qs.pdf",
  "sha256": "787ad5492b60949988e7e39ca532ac7c1c78ebfe5b3cbd9af4e6f621793ddd9a",
  "checkedOn": "2026-10-26",
  "type": "official_problem",
  "availability": "officially_published",
  "scope": "QS物理38〜45の全8頁・4表/3図/2関数/6欄28択のみ。",
  "sections": [
    "物理p38 問8",
    "物理p39 問8",
    "物理p40 問8",
    "物理p41 問8",
    "物理p42 問8",
    "物理p43 問8",
    "物理p44 問8",
    "物理p45 問8"
  ],
  "dateNote": "2017年度公式掲載公開2017-10-15/更新2018-01-12。個別PDF添付日とは分ける。",
  "facts": [
    "旧制度・午後150分の必須問8。6解答欄を全て解答する。",
    "N=30/独自文字値，1始まり，生成長1以上/検証長2以上。行と列の対象/未記入/網掛けを保持。"
  ],
  "supports": [
    "source-format",
    "answer-validation"
  ],
  "limits": "問8の問題PDF物理p38〜45の全本文、図表、注記と解答群に限る。 他の大問・付属資料・第三者素材へこの条件判断を拡張しない。独自解説の条件は公式素材と分ける。"
}
