{
  "schemaVersion": "3.0.0",
  "id": "source-ipa-2017h29a-fe-pm-6-qs",
  "title": "平成29年度 秋期 基本情報技術者試験 午後 問6 運用サービス予算と提示価格 全5頁",
  "publisher": "独立行政法人情報処理推進機構（IPA）",
  "url": "https://www.ipa.go.jp/shiken/mondai-kaiotu/gmcbt8000000fqpm-att/2017h29a_fe_pm_qs.pdf",
  "sha256": "787ad5492b60949988e7e39ca532ac7c1c78ebfe5b3cbd9af4e6f621793ddd9a",
  "checkedOn": "2026-10-26",
  "type": "official_problem",
  "availability": "officially_published",
  "scope": "QS物理28〜32全5頁，本文・2表・7欄36択・丸め注記。",
  "sections": [
    "物理p28 問6",
    "物理p29 問6",
    "物理p30 問6",
    "物理p31 問6",
    "物理p32 問6"
  ],
  "dateNote": "2017年度公式掲載公開2017-10-15/更新2018-01-12。個別PDF添付日とは分ける。",
  "facts": [
    "旧制度・午後150分，問2〜7から4問を選ぶ大問の一つ。",
    "2017年度実績は見込みを実績と呼ぶ。率は提示価格を分母とし最終%だけ小数第2位を四捨五入。"
  ],
  "supports": [
    "source-format",
    "answer-validation"
  ],
  "limits": "問6の問題PDF物理p28〜32の全本文、図表、注記と解答群に限る。 他の大問・付属資料・第三者素材へこの条件判断を拡張しない。独自解説の条件は公式素材と分ける。"
}
