{
  "schemaVersion": "3.0.0",
  "id": "source-ipa-2018h30h-fe-pm-10-erratum",
  "title": "平成30年度 春期 基本情報技術者試験 午後 問10 公式正誤表（問10）",
  "publisher": "独立行政法人情報処理推進機構（IPA）",
  "url": "https://www.ipa.go.jp/shiken/mondai-kaiotu/gmcbt8000000fabr-att/2018h30h_fe_pm_qs.pdf",
  "sha256": "bb172e6225037b05e18aec455f7aec8ec66f3e82838c92a27bb50d2d203dbfb9",
  "checkedOn": "2026-10-27",
  "type": "official_problem",
  "availability": "officially_published",
  "scope": "問10 公式正誤表（問10） 物理p.2。他年度・他問の判断へ拡張しない。",
  "sections": [
    "物理p.2"
  ],
  "dateNote": "試験年度を個別PDFの初回公開日へ推定しない。",
  "facts": [
    "6操作欄、22固有択、28欄別参照。"
  ],
  "supports": [
    "annual-sets",
    "random-mix",
    "answer-validation"
  ],
  "limits": "当該冊子に添付された問10の公式正誤表。問題本文と分けて参照できる。"
}
