{
  "schemaVersion": "3.0.0",
  "id": "source-ipa-2018h30h-fe-pm-2-ans",
  "title": "平成30年度 春期 基本情報技術者試験 午後 問2 公式解答例",
  "publisher": "独立行政法人情報処理推進機構（IPA）",
  "url": "https://www.ipa.go.jp/shiken/mondai-kaiotu/gmcbt8000000fabr-att/2018h30h_fe_pm_ans.pdf",
  "sha256": "50c0b5defdb6a579048671d6a371e1ecf982ad59d370c08d1909e16d0f7b0777",
  "checkedOn": "2026-10-27",
  "type": "official_answer",
  "availability": "officially_published",
  "scope": "問2 公式解答例 物理p.1。他年度・他問の判断へ拡張しない。",
  "sections": [
    "物理p.1"
  ],
  "dateNote": "試験年度を個別PDFの初回公開日へ推定しない。",
  "facts": [
    "5操作欄、15固有択、26欄別参照。"
  ],
  "supports": [
    "annual-sets",
    "random-mix",
    "answer-validation"
  ],
  "limits": "当該問の公式解答の出典。アプリの解説・用語補足は本プロジェクトの独自記述。"
}
