{
  "schemaVersion": "3.0.0",
  "id": "source-ipa-2017h29h-fe-pm-9-ans",
  "title": "平成29年度 春期 基本情報技術者試験 午後 問9 解答例7欄",
  "publisher": "独立行政法人情報処理推進機構（IPA）",
  "url": "https://www.ipa.go.jp/shiken/mondai-kaiotu/gmcbt8000000fzx1-att/2017h29h_fe_pm_ans.pdf",
  "sha256": "7d83ed5839b533c1a2bc804698e08eb6bb55865ef1aef3f74e15c42faad7772b",
  "checkedOn": "2026-10-26",
  "type": "official_answer",
  "availability": "officially_published",
  "scope": "ANS物理1頁の問9 a〜g正答。",
  "sections": [
    "p1 問9 設問1 a/b/c・設問2 d/e・設問3 f/g"
  ],
  "dateNote": "年度ページの掲載日を個別PDFの初回公表日と断定しない。",
  "facts": [
    "旧午後150分、問9〜13から1問を選択。現行科目Bの形式と区別。",
    "unsigned intは16bit。末尾の多重マークは順不同集計から除外。"
  ],
  "supports": [
    "annual-sets",
    "random-mix",
    "answer-validation"
  ],
  "limits": "問9局所素材・Cプログラムのみ。CASL/JIS/表計算資料の権利へ広げない。"
}
