{
  "schemaVersion": "3.0.0",
  "id": "source-ipa-2017h29a-fe-pm-10-qs",
  "title": "平成29年度 秋期 基本情報技術者試験 午後 問10 COBOL駐車料金 全5頁",
  "publisher": "独立行政法人情報処理推進機構（IPA）",
  "url": "https://www.ipa.go.jp/shiken/mondai-kaiotu/gmcbt8000000fqpm-att/2017h29a_fe_pm_qs.pdf",
  "sha256": "787ad5492b60949988e7e39ca532ac7c1c78ebfe5b3cbd9af4e6f621793ddd9a",
  "checkedOn": "2026-10-26",
  "type": "official_problem",
  "availability": "officially_published",
  "scope": "QS53〜57、原21+43行、3図、表1、全25固有択31参照、全注記。",
  "sections": [
    "p53 問10",
    "p54 問10",
    "p55 問10",
    "p56 問10",
    "p57 問10"
  ],
  "dateNote": "年度掲載日と各添付の初回公開日を同一と断定しない。",
  "facts": [
    "150分・9〜13から1大問を選択。",
    "1課金単位は入庫分を基準とする1時間、開始1分以上で課金。"
  ],
  "supports": [
    "annual-sets",
    "random-mix",
    "answer-validation"
  ],
  "limits": "問10の問題PDF物理p53〜57の全本文、図表、注記と解答群に限る。 他の大問・付属資料・第三者素材へこの条件判断を拡張しない。独自解説の条件は公式素材と分ける。"
}
